{"cases":[{"assertion_evaluations":[{"assertion_id":"g1c-asm-009","effective_from":"2025-10-31","effective_legal_effect_at_as_of":"ENTITLED_TO_PROVIDE","effective_to":null,"evidence":[{"authority":"European Securities and Markets Authority (ESMA)","extractor_version":"FINREG_G05A_EXTRACTION_V3","observed_current":true,"raw_snapshot_sha256":"0af299b12a3086e336cf6eaded8db9fee0db6a501b84b8d04467305b38a51a9a","raw_value":"{\"fields\":{\"authorisation_end_date\":\"\",\"authorisation_notification_date\":\"31/10/2025\",\"commercial_name\":\"Bit2Me\",\"competent_authority\":\"Comision Nacional del Mercado de Valores (CNMV)\",\"home_member_state\":\"ES\",\"last_update\":\"03/11/2025\",\"legal_name\":\"Bitcoinforme S.L.\",\"lei\":\"9598007R5LSUJLGLS853\",\"lei_diagnostic\":\"9598007R5LSUJLGLS853\",\"lei_valid\":\"9598007R5LSUJLGLS853\",\"service_codes_raw\":\"a. providing custody and administration of crypto-assets on behalf of clients.|c. exchange of crypto-assets for funds|d. exchange of crypto-assets for other crypto-assets|e. execution of orders for crypto-assets on behalf of clients.|f. placing of crypto-assets|g. reception and transmission of orders for crypto-assets on behalf of clients.|j. providing transfer services for crypto-assets on behalf of clients.\",\"service_countries_raw\":\"ES|AT|BE|BG|CY|CZ|DE|DK|EE|GR|FI|FR|HR|HU|IE|IS|IT|LI|LT|LU|LV|MT|NL|NO|PL|PT|RO|SE|SI|SK\"},\"record_key\":{\"field\":\"ae_lei\",\"value\":\"9598007R5LSUJLGLS853\"}}","register_id":"ESMA_MICA_REGISTER","retrieved_at":"2026-09-13","source_as_of":null,"source_date_reliability":"UNAVAILABLE","source_url":"https://www.esma.europa.eu/sites/default/files/2024-12/CASPS.csv"},{"authority":"Comisión Nacional del Mercado de Valores (CNMV)","extractor_version":"CNMV_PSC_EXTRACT_V1","observed_current":true,"raw_snapshot_sha256":"dfd245433897476380a68a5cd75f85ad0ef8541bf479a2c60c505f6ebeba3045","raw_value":"{\"fields\":{\"cnmv_category\":\"PSC (ESPAÑA)\",\"legal_name\":\"BITCOINFORME, S.L. (BIT2ME)\",\"mica_route_label\":\"art.63 candidate\",\"services_from\":\"31/10/2025\"},\"record_key\":{\"field\":\"entity\",\"value\":\"BITCOINFORME, S.L. (BIT2ME)\"}}","register_id":"CNMV_PSC_REGISTER","retrieved_at":"2026-09-14","source_as_of":null,"source_date_reliability":"UNAVAILABLE","source_url":"https://www.cnmv.es/Docportal/Proveedores-Servicios-Criptoactivos/Listado_ProveedoresCriptoactivos.pdf"}],"legal_basis":"MiCA (UE) 2023/1114 art. 63 + categoria CNMV 'PSC (ESPAÑA)': autorizacion CASP especifica; mecanismo anclado en fuente NCA primaria, no inferido del CSV ESMA","reason":"IN_EFFECT","register_id":"ESMA_MICA_REGISTER","source_legal_effect":"ENTITLED_TO_PROVIDE"}],"assessment":"CONFIRMED_ENTITLED","case_id":"G1C-01","derived_assertion_ids":[],"diagnostics":[],"entry_mechanism_match":true,"entry_mechanisms":["AUTHORISATION"],"expected_assessment":"CONFIRMED_ENTITLED","expected_entry_mechanism":"AUTHORISATION","expected_reason":"ACTIVE_ENTITLEMENT_EVIDENCED","identity_resolution":"EXACT","match":true,"matched_reported_fact_ids":["g1c-fact-002"],"matching_assertion_ids":["g1c-asm-009"],"query":{"activity":"CRYPTO_CUSTODY_ADMINISTRATION","as_of":"2026-09-15","entity_id":"G05-004","jurisdiction":"ES"},"reason":"ACTIVE_ENTITLEMENT_EVIDENCED","reason_match":true,"source_claim_ids":["G05-004|CNMV_PSC_REGISTER|cnmv_category","G05-004|CNMV_PSC_REGISTER|legal_name","G05-004|CNMV_PSC_REGISTER|mica_route_label","G05-004|CNMV_PSC_REGISTER|services_from","G05-004|ESMA_MICA_REGISTER|authorisation_end_date","G05-004|ESMA_MICA_REGISTER|authorisation_notification_date","G05-004|ESMA_MICA_REGISTER|commercial_name","G05-004|ESMA_MICA_REGISTER|competent_authority","G05-004|ESMA_MICA_REGISTER|home_member_state","G05-004|ESMA_MICA_REGISTER|last_update","G05-004|ESMA_MICA_REGISTER|legal_name","G05-004|ESMA_MICA_REGISTER|lei","G05-004|ESMA_MICA_REGISTER|lei_diagnostic","G05-004|ESMA_MICA_REGISTER|lei_valid","G05-004|ESMA_MICA_REGISTER|service_codes_raw","G05-004|ESMA_MICA_REGISTER|service_countries_raw"],"used_assertion_ids":["g1c-asm-009"]},{"assertion_evaluations":[{"assertion_id":"g1c-asm-002","effective_from":"2025-03-05","effective_legal_effect_at_as_of":"ENTITLED_TO_PROVIDE","effective_to":null,"evidence":[{"authority":"European Securities and Markets Authority (ESMA)","extractor_version":"FINREG_G05A_EXTRACTION_V3","observed_current":true,"raw_snapshot_sha256":"0af299b12a3086e336cf6eaded8db9fee0db6a501b84b8d04467305b38a51a9a","raw_value":"{\"fields\":{\"authorisation_end_date\":\"\",\"authorisation_notification_date\":\"05/03/2025\",\"commercial_name\":\"BBVA\",\"competent_authority\":\"Comision Nacional del Mercado de Valores (CNMV)\",\"home_member_state\":\"ES\",\"last_update\":\"07/03/2026\",\"legal_name\":\"Banco Bilbao Vizcaya Argentaria S.A.\",\"lei\":\"K8MS7FD7N5Z2WQ51AZ71\",\"lei_diagnostic\":\"K8MS7FD7N5Z2WQ51AZ71\",\"lei_valid\":\"K8MS7FD7N5Z2WQ51AZ71\",\"service_codes_raw\":\"a. providing custody and administration of crypto-assets on behalf of clients.|e. execution of orders for crypto-assets on behalf of clients.|j. providing transfer services for crypto-assets on behalf of clients.\",\"service_countries_raw\":\"ES\"},\"record_key\":{\"field\":\"ae_lei\",\"value\":\"K8MS7FD7N5Z2WQ51AZ71\"}}","register_id":"ESMA_MICA_REGISTER","retrieved_at":"2026-09-13","source_as_of":null,"source_date_reliability":"UNAVAILABLE","source_url":"https://www.esma.europa.eu/sites/default/files/2024-12/CASPS.csv"},{"authority":"Comisión Nacional del Mercado de Valores (CNMV)","extractor_version":"CNMV_PSC_EXTRACT_V1","observed_current":true,"raw_snapshot_sha256":"dfd245433897476380a68a5cd75f85ad0ef8541bf479a2c60c505f6ebeba3045","raw_value":"{\"fields\":{\"cnmv_category\":\"ENTIDAD DE CRÉDITO (ESPAÑA)\",\"legal_name\":\"BANCO BILBAO VIZCAYA ARGENTARIA, S.A.\",\"mica_route_label\":\"art.60 candidate\",\"services_from\":\"05/03/2025\"},\"record_key\":{\"field\":\"entity\",\"value\":\"BANCO BILBAO VIZCAYA ARGENTARIA, S.A.\"}}","register_id":"CNMV_PSC_REGISTER","retrieved_at":"2026-09-14","source_as_of":null,"source_date_reliability":"UNAVAILABLE","source_url":"https://www.cnmv.es/Docportal/Proveedores-Servicios-Criptoactivos/Listado_ProveedoresCriptoactivos.pdf"}],"legal_basis":"MiCA (UE) 2023/1114 art. 60.1: entidad de credito preexistente, notificacion 40 dias habiles (categoria CNMV 'ENTIDAD DE CRÉDITO (ESPAÑA)'); sujeto a restricciones CRD nacionales (ESMA QA 2088)","reason":"IN_EFFECT","register_id":"ESMA_MICA_REGISTER","source_legal_effect":"ENTITLED_TO_PROVIDE"}],"assessment":"CONFIRMED_ENTITLED","case_id":"G1C-02","derived_assertion_ids":[],"diagnostics":[],"entry_mechanism_match":true,"entry_mechanisms":["NOTIFICATION"],"expected_assessment":"CONFIRMED_ENTITLED","expected_entry_mechanism":"NOTIFICATION","expected_reason":"ACTIVE_ENTITLEMENT_EVIDENCED","identity_resolution":"EXACT","match":true,"matched_reported_fact_ids":[],"matching_assertion_ids":["g1c-asm-002"],"query":{"activity":"CRYPTO_ORDER_EXECUTION","as_of":"2026-09-15","entity_id":"G05-001","jurisdiction":"ES"},"reason":"ACTIVE_ENTITLEMENT_EVIDENCED","reason_match":true,"source_claim_ids":["G05-001|CNMV_PSC_REGISTER|cnmv_category","G05-001|CNMV_PSC_REGISTER|legal_name","G05-001|CNMV_PSC_REGISTER|mica_route_label","G05-001|CNMV_PSC_REGISTER|services_from","G05-001|ESMA_MICA_REGISTER|authorisation_end_date","G05-001|ESMA_MICA_REGISTER|authorisation_notification_date","G05-001|ESMA_MICA_REGISTER|commercial_name","G05-001|ESMA_MICA_REGISTER|competent_authority","G05-001|ESMA_MICA_REGISTER|home_member_state","G05-001|ESMA_MICA_REGISTER|last_update","G05-001|ESMA_MICA_REGISTER|legal_name","G05-001|ESMA_MICA_REGISTER|lei","G05-001|ESMA_MICA_REGISTER|lei_diagnostic","G05-001|ESMA_MICA_REGISTER|lei_valid","G05-001|ESMA_MICA_REGISTER|service_codes_raw","G05-001|ESMA_MICA_REGISTER|service_countries_raw"],"used_assertion_ids":["g1c-asm-002"]},{"assertion_evaluations":[{"assertion_id":"g1c-asm-025","effective_from":"2026-03-27","effective_legal_effect_at_as_of":"ENTITLED_TO_PROVIDE","effective_to":null,"evidence":[{"authority":"European Securities and Markets Authority (ESMA)","extractor_version":"FINREG_G05A_EXTRACTION_V3","observed_current":true,"raw_snapshot_sha256":"0af299b12a3086e336cf6eaded8db9fee0db6a501b84b8d04467305b38a51a9a","raw_value":"{\"fields\":{\"authorisation_end_date\":\"\",\"authorisation_notification_date\":\"27/03/2026\",\"commercial_name\":\"CAIXABANK\",\"competent_authority\":\"Comision Nacional del Mercado de Valores (CNMV)\",\"home_member_state\":\"ES\",\"last_update\":\"27/03/2026\",\"legal_name\":\"CAIXABANK S.A.\",\"lei\":\"7CUNS533WID6K7DGFI87\",\"lei_diagnostic\":\"7CUNS533WID6K7DGFI87\",\"lei_valid\":\"7CUNS533WID6K7DGFI87\",\"service_codes_raw\":\"a. providing custody and administration of crypto-assets on behalf of clients.|e. execution of orders for crypto-assets on behalf of clients.|g. reception and transmission of orders for crypto-assets on behalf of clients.|j. providing transfer services for crypto-assets on behalf of clients.\",\"service_countries_raw\":\"ES\"},\"record_key\":{\"field\":\"ae_lei\",\"value\":\"7CUNS533WID6K7DGFI87\"}}","register_id":"ESMA_MICA_REGISTER","retrieved_at":"2026-09-13","source_as_of":null,"source_date_reliability":"UNAVAILABLE","source_url":"https://www.esma.europa.eu/sites/default/files/2024-12/CASPS.csv"},{"authority":"Comisión Nacional del Mercado de Valores (CNMV)","extractor_version":"CNMV_PSC_EXTRACT_V1","observed_current":true,"raw_snapshot_sha256":"dfd245433897476380a68a5cd75f85ad0ef8541bf479a2c60c505f6ebeba3045","raw_value":"{\"fields\":{\"cnmv_category\":\"ENTIDAD DE CRÉDITO (ESPAÑA)\",\"legal_name\":\"CAIXABANK, S.A.\",\"mica_route_label\":\"art.60 candidate\",\"services_from\":\"27/03/2026\"},\"record_key\":{\"field\":\"entity\",\"value\":\"CAIXABANK, S.A.\"}}","register_id":"CNMV_PSC_REGISTER","retrieved_at":"2026-09-14","source_as_of":null,"source_date_reliability":"UNAVAILABLE","source_url":"https://www.cnmv.es/Docportal/Proveedores-Ser